{
 "authority": {
  "can_apply_swap": false,
  "can_approve_or_lock": false,
  "can_decide": false
 },
 "counts": {
  "claim_eligible_from_M5": 0,
  "hypotheses": 121,
  "positive_other_or_unknown_coverage": 1,
  "positive_proxy_verdicts": 1,
  "positive_unmodeled_swap_effects": 0
 },
 "deck_id": "Lord_of_Tresserhorn",
 "items": [
  {
   "has_positive_proxy_verdict": true,
   "multiplayer_model_limit": true,
   "reason": "M5_goldfish_incomplete_or_unknown_coverage",
   "required_next": "Phase-B effect-aware comparisons and named strategic judgment before any improvement claim",
   "review_order": 1,
   "supports_improvement_claim": false,
   "swap_id": "swap:lord-of-tresserhorn:m5:a7d496f4bfea",
   "swapped_effects_unmodeled": false,
   "test_verdicts": [
    "pass"
   ]
  },
  {
   "has_positive_proxy_verdict": false,
   "multiplayer_model_limit": true,
   "reason": "M5_exploratory_no_positive_verdict",
   "required_next": "Phase-B effect-aware comparisons and named strategic judgment before any improvement claim",
   "review_order": 2,
   "supports_improvement_claim": false,
   "swap_id": "swap:lord-of-tresserhorn:m5:2584be391b31",
   "swapped_effects_unmodeled": true,
   "test_verdicts": [
    "fail"
   ]
  },
  {
   "has_positive_proxy_verdict": false,
   "multiplayer_model_limit": true,
   "reason": "M5_exploratory_no_positive_verdict",
   "required_next": "Phase-B effect-aware comparisons and named strategic judgment before any improvement claim",
   "review_order": 3,
   "supports_improvement_claim": false,
   "swap_id": "swap:lord-of-tresserhorn:m5:6f2d5ea598ae",
   "swapped_effects_unmodeled": true,
   "test_verdicts": [
    "no_detectable_difference"
   ]
  },
  {
   "has_positive_proxy_verdict": false,
   "multiplayer_model_limit": true,
   "reason": "M5_exploratory_no_positive_verdict",
   "required_next": "Phase-B effect-aware comparisons and named strategic judgment before any improvement claim",
   "review_order": 4,
   "supports_improvement_claim": false,
   "swap_id": "swap:lord-of-tresserhorn:m5:bca8b98db96c",
   "swapped_effects_unmodeled": true,
   "test_verdicts": [
    "no_detectable_difference"
   ]
  },
  {
   "has_positive_proxy_verdict": false,
   "multiplayer_model_limit": true,
   "reason": "M5_exploratory_no_positive_verdict",
   "required_next": "Phase-B effect-aware comparisons and named strategic judgment before any improvement claim",
   "review_order": 5,
   "supports_improvement_claim": false,
   "swap_id": "swap:lord-of-tresserhorn:m5:05de6eb03e66",
   "swapped_effects_unmodeled": true,
   "test_verdicts": [
    "inconclusive"
   ]
  },
  {
   "has_positive_proxy_verdict": false,
   "multiplayer_model_limit": true,
   "reason": "M5_exploratory_no_positive_verdict",
   "required_next": "Phase-B effect-aware comparisons and named strategic judgment before any improvement claim",
   "review_order": 6,
   "supports_improvement_claim": false,
   "swap_id": "swap:lord-of-tresserhorn:m5:a11125aa2c0d",
   "swapped_effects_unmodeled": true,
   "test_verdicts": [
    "inconclusive"
   ]
  },
  {
   "has_positive_proxy_verdict": false,
   "multiplayer_model_limit": true,
   "reason": "M5_exploratory_no_positive_verdict",
   "required_next": "Phase-B effect-aware comparisons and named strategic judgment before any improvement claim",
   "review_order": 7,
   "supports_improvement_claim": false,
   "swap_id": "swap:lord-of-tresserhorn:m5:b8b14f5a704d",
   "swapped_effects_unmodeled": true,
   "test_verdicts": [
    "inconclusive"
   ]
  },
  {
   "has_positive_proxy_verdict": false,
   "multiplayer_model_limit": true,
   "reason": "M5_exploratory_no_positive_verdict",
   "required_next": "Phase-B effect-aware comparisons and named strategic judgment before any improvement claim",
   "review_order": 8,
   "supports_improvement_claim": false,
   "swap_id": "swap:lord-of-tresserhorn:m5:f366a44a99b6",
   "swapped_effects_unmodeled": true,
   "test_verdicts": [
    "inconclusive"
   ]
  },
  {
   "has_positive_proxy_verdict": false,
   "multiplayer_model_limit": true,
   "reason": "M5_exploratory_no_positive_verdict",
   "required_next": "Phase-B effect-aware comparisons and named strategic judgment before any improvement claim",
   "review_order": 9,
   "supports_improvement_claim": false,
   "swap_id": "swap:lord-of-tresserhorn:m5:146147d33fbc",
   "swapped_effects_unmodeled": true,
   "test_verdicts": [
    "no_detectable_difference"
   ]
  },
  {
   "has_positive_proxy_verdict": false,
   "multiplayer_model_limit": true,
   "reason": "M5_exploratory_no_positive_verdict",
   "required_next": "Phase-B effect-aware comparisons and named strategic judgment before any improvement claim",
   "review_order": 10,
   "supports_improvement_claim": false,
   "swap_id": "swap:lord-of-tresserhorn:m5:029ada0a674c",
   "swapped_effects_unmodeled": true,
   "test_verdicts": [
    "no_detectable_difference"
   ]
  },
  {
   "has_positive_proxy_verdict": false,
   "multiplayer_model_limit": true,
   "reason": "M5_exploratory_no_positive_verdict",
   "required_next": "Phase-B effect-aware comparisons and named strategic judgment before any improvement claim",
   "review_order": 11,
   "supports_improvement_claim": false,
   "swap_id": "swap:lord-of-tresserhorn:m5:f3bd39d209f9",
   "swapped_effects_unmodeled": true,
   "test_verdicts": [
    "inconclusive"
   ]
  },
  {
   "has_positive_proxy_verdict": false,
   "multiplayer_model_limit": true,
   "reason": "M5_exploratory_no_positive_verdict",
   "required_next": "Phase-B effect-aware comparisons and named strategic judgment before any improvement claim",
   "review_order": 12,
   "supports_improvement_claim": false,
   "swap_id": "swap:lord-of-tresserhorn:m5:b34473c03763",
   "swapped_effects_unmodeled": true,
   "test_verdicts": [
    "inconclusive"
   ]
  },
  {
   "has_positive_proxy_verdict": false,
   "multiplayer_model_limit": true,
   "reason": "M5_exploratory_no_positive_verdict",
   "required_next": "Phase-B effect-aware comparisons and named strategic judgment before any improvement claim",
   "review_order": 13,
   "supports_improvement_claim": false,
   "swap_id": "swap:lord-of-tresserhorn:m5:2b30eab1d400",
   "swapped_effects_unmodeled": true,
   "test_verdicts": [
    "inconclusive"
   ]
  },
  {
   "has_positive_proxy_verdict": false,
   "multiplayer_model_limit": true,
   "reason": "M5_exploratory_no_positive_verdict",
   "required_next": "Phase-B effect-aware comparisons and named strategic judgment before any improvement claim",
   "review_order": 14,
   "supports_improvement_claim": false,
   "swap_id": "swap:lord-of-tresserhorn:m5:932db0c8b0e7",
   "swapped_effects_unmodeled": true,
   "test_verdicts": [
    "no_detectable_difference"
   ]
  },
  {
   "has_positive_proxy_verdict": false,
   "multiplayer_model_limit": true,
   "reason": "M5_exploratory_no_positive_verdict",
   "required_next": "Phase-B effect-aware comparisons and named strategic judgment before any improvement claim",
   "review_order": 15,
   "supports_improvement_claim": false,
   "swap_id": "swap:lord-of-tresserhorn:m5:9dd614a1d008",
   "swapped_effects_unmodeled": true,
   "test_verdicts": [
    "inconclusive"
   ]
  },
  {
   "has_positive_proxy_verdict": false,
   "multiplayer_model_limit": true,
   "reason": "M5_exploratory_no_positive_verdict",
   "required_next": "Phase-B effect-aware comparisons and named strategic judgment before any improvement claim",
   "review_order": 16,
   "supports_improvement_claim": false,
   "swap_id": "swap:lord-of-tresserhorn:m5:d88a38b94047",
   "swapped_effects_unmodeled": true,
   "test_verdicts": [
    "inconclusive"
   ]
  },
  {
   "has_positive_proxy_verdict": false,
   "multiplayer_model_limit": true,
   "reason": "M5_exploratory_no_positive_verdict",
   "required_next": "Phase-B effect-aware comparisons and named strategic judgment before any improvement claim",
   "review_order": 17,
   "supports_improvement_claim": false,
   "swap_id": "swap:lord-of-tresserhorn:m5:be5333c05541",
   "swapped_effects_unmodeled": true,
   "test_verdicts": [
    "no_detectable_difference"
   ]
  },
  {
   "has_positive_proxy_verdict": false,
   "multiplayer_model_limit": true,
   "reason": "M5_exploratory_no_positive_verdict",
   "required_next": "Phase-B effect-aware comparisons and named strategic judgment before any improvement claim",
   "review_order": 18,
   "supports_improvement_claim": false,
   "swap_id": "swap:lord-of-tresserhorn:m5:c5950a8cd433",
   "swapped_effects_unmodeled": true,
   "test_verdicts": [
    "inconclusive"
   ]
  },
  {
   "has_positive_proxy_verdict": false,
   "multiplayer_model_limit": true,
   "reason": "M5_exploratory_no_positive_verdict",
   "required_next": "Phase-B effect-aware comparisons and named strategic judgment before any improvement claim",
   "review_order": 19,
   "supports_improvement_claim": false,
   "swap_id": "swap:lord-of-tresserhorn:m5:e55f04b0dcd0",
   "swapped_effects_unmodeled": true,
   "test_verdicts": [
    "inconclusive"
   ]
  },
  {
   "has_positive_proxy_verdict": false,
   "multiplayer_model_limit": true,
   "reason": "M5_exploratory_no_positive_verdict",
   "required_next": "Phase-B effect-aware comparisons and named strategic judgment before any improvement claim",
   "review_order": 20,
   "supports_improvement_claim": false,
   "swap_id": "swap:lord-of-tresserhorn:m5:d141cb2071f9",
   "swapped_effects_unmodeled": true,
   "test_verdicts": [
    "no_detectable_difference"
   ]
  },
  {
   "has_positive_proxy_verdict": false,
   "multiplayer_model_limit": true,
   "reason": "M5_exploratory_no_positive_verdict",
   "required_next": "Phase-B effect-aware comparisons and named strategic judgment before any improvement claim",
   "review_order": 21,
   "supports_improvement_claim": false,
   "swap_id": "swap:lord-of-tresserhorn:m5:bd5cdccc82ba",
   "swapped_effects_unmodeled": true,
   "test_verdicts": [
    "no_detectable_difference"
   ]
  },
  {